<?xml version="1.0" encoding="UTF-8"?>
<svx xmlns="http://www.toppfotball.no/schema"
	xmlns:xsi="http://www.w3.org/2001/XMLSchema-instance"
	xsi:schemaLocation="http://www.toppfotball.no/schema svx.xsd">

	<events>
		<event code="1" date="2009-04-01" location="London" homeTeam="arsenal" awayTeam="barcelona"/>
	</events>
		
	<clips>
		<clip start="4" team="barcelona" filename="v101.mp4" event="1">
			<categories>
				<category>etablert</category>
				<category>heading</category>
			</categories>
			<persons>
				<person>xavihernandez</person>
			</persons>
		</clip>
		<clip start="0" team="barcelona" filename="v102.mp4" event="1">
			<categories>
				<category>overgang</category>
			</categories>
			<persons>
				<person>xavihernandez</person>
			</persons>
		</clip>
		<clip start="0" team="barcelona" filename="v103.mp4" event="1">
			<categories>
				<category>etablert</category>
			</categories>
			<persons>
				<person>lionelmessi</person>
			</persons>
		</clip>
		<clip start="0" team="barcelona" filename="v104.mp4" event="1">
			<categories>
				<category>overgang</category>
				<category>utsidetouch</category>
			</categories>
			<persons>
				<person>lionelmessi</person>
			</persons>
		</clip>
		<clip start="0" team="barcelona" filename="v105.mp4" event="1">
			<persons>
				<person>lionelmessi</person>
			</persons>
		</clip>
	</clips>

</svx>
